,text,title
2005,播放一个八岐大蛇CG视频,Video-Play
2006,上海这个星期啥时候能没有雨,Weather-Query
2007,几月几号是采花节,Calendar-Query
2008,香港的电影叶问3拍摄花絮播放出来,Video-Play
2009,给我播放2018年亚运会的视频，我想了解当时的比赛情况,Video-Play
2010,什么脸型适合戴平光镜,Other
2011,厦门今天的紫外线指数是不是很低。,Weather-Query
2012,苏小明朋友们好我在这个戏里演他的一个表妹的妈妈,FilmTele-Play
2013,帮我关闭浴霸所有功能可不可以呢,HomeAppliance-Control
2014,帮我放一下情感疗愈节目解忧电台,Radio-Listen
2015,电视剧自古英雄出少年拍摄消息一出即在网上引发网友热议,FilmTele-Play
2016,我想要的是歌王迈克尔杰克逊的档案麻烦详细点谢谢合作,FilmTele-Play
2017,这个周末上午9点左右去采摘园摘草莓的闹钟帮我设置下,Alarm-Update
2018,贾玲今年导演的那个电影看一下吧,FilmTele-Play
2019,陕西农林卫视的三农信息联播可以给我回放下吗我想看下,Radio-Listen
2020,循环收听北京故事广播的读书俱乐部,Radio-Listen
2021,下午三点有大话西游吗帮我看下,TVProgram-Play
2022,将空调设为上下扫风,HomeAppliance-Control
2023,苏州的昼夜温差多少啊,Weather-Query
2024,请继续给我播放呼啸山庄的第三章来听,Music-Play
2025,星期二大连会有冰雹吗,Weather-Query
2026,除了李亚鹏决定退居幕后记者获悉王菲也对投拍影视剧产生兴趣,FilmTele-Play
2027,给我放一下5月26日的世乓赛的情况呢,Video-Play
2028,珠江现在有什么吸引人的电视剧吗我想看下,TVProgram-Play
2029,下个月西安的温度是不是会上升？,Weather-Query
2030,帮我找CCTV1在5月26的新闻联播好吗,Video-Play
2031,现在去深圳北站怎么坐公交,Travel-Query
2032,而面对毛茸茸的孙悟空韩雪如何自然地与其演对手戏呢,FilmTele-Play
2033,美国演员安妮海瑟薇的剧给我立刻播放呢,FilmTele-Play
2034,回放6点32在CCTV10播出的探索·发现-2021-150,TVProgram-Play
2035,既然我设置的铃声自己听不到我想把它删除可以吗谢谢,HomeAppliance-Control
2036,届时她在会上推广环保理念,Alarm-Update
2037,帮我赶快查查星期几是青年节啊,Calendar-Query
2038,我想调低温度空调快,HomeAppliance-Control
2039,我颠覆了整个世界只为摆正你的倒影用因英语怎么翻译,Other
2040,唐勇的说法得到了湖南省卫生厅医政处调研员鲁鸿安的认同,Other
2041,5分钟后告诉我10月25日是阴历多少,Calendar-Query
2042,我18号和30号安排一个新的日程,Alarm-Update
2043,采花节是周几,Calendar-Query
2044,国庆节是农历8月16吗,Calendar-Query
2045,周五到周日三天韶关有大暴雨吗,Weather-Query
2046,并把空调温度调低到23,HomeAppliance-Control
2047,看一下CCTV10科教台的百家讲坛,FilmTele-Play
2048,你找一个今年中国上线的喜剧片可以吗,FilmTele-Play
2049,王祖蓝将刘子千在中歪嘴摆头兼眨眼的夸张表情学到足十分爆笑,Music-Play
2050,他还表示自己将出任山东卫视中华达人的评委,FilmTele-Play
2051,有没有女驸马我想听戏曲,Music-Play
2052,可以让扫地机器人开始工作吧,HomeAppliance-Control
2053,请问QQD电信可不可以用QQ二零零八JAVA正式版登陆QQ,Other
2054,可以告诉我下空调现在调的是什么模式吗,HomeAppliance-Control
2055,添仓节是几月几号,Calendar-Query
2056,不管世界如何对高圆圆来说家人安康便是最大的修为,FilmTele-Play
2057,来首俄语歌听,Music-Play
2058,主持人赵宁说到在这部片子当中也有吻戏的部分尴不尴尬呢,Radio-Listen
2059,3月22日的吉林新闻早报还能看回放吗我想看下,TVProgram-Play
2060,空调温度调高一下,HomeAppliance-Control
2061,昨天9点30左右在中央9套播出的跨过鸭绿江帮我放一下,TVProgram-Play
2062,最近丽江是晴天吗,Weather-Query
2063,临床治疗神经衰弱的具体药物名称,FilmTele-Play
2064,重新播放前天的十分好球,FilmTele-Play
2065,麻烦继续查哪趟去东京的飞机的餐食好,Travel-Query
2066,查小欣我说的只是事实而已,FilmTele-Play
2067,我想看下去年宋祖儿跨年晚会演的那个小品,Video-Play
2068,帮我设置18号早上8点参加上海车展的提醒。,Alarm-Update
2069,给我空调调低5度,HomeAppliance-Control
2070,单曲循环播放恋曲1990,Music-Play
2071,可以帮我找找今天播放的盛唐幻夜在哪个吗我想看下,TVProgram-Play
2072,放一个司马光砸缸的故事给小孩子听,Audio-Play
2073,雪中悍刀行能给我读来听一下吗,Music-Play
2074,我想看科幻剧我就是这般女子,FilmTele-Play
2075,能不能说一说农历的几月几号是元宵节啊,Calendar-Query
2076,帮我开一下电烤箱吧，我想烤鸡翅吃,HomeAppliance-Control
2077,中秋节是周几,Calendar-Query
2078,我想听潘长江的春晚小品相女婿,Video-Play
2079,有知情人爆料郭德纲的二徒弟曹云金也已萌生了退意,Other
2080,今天的农历是几月初几,Calendar-Query
2081,请循环播放张信哲的过火。,Music-Play
2082,周日6点早起闹钟提醒,Alarm-Update
2083,我想看最好的图片美女,FilmTele-Play
2084,赶紧告诉我一下运城开过来的高铁今天有票吗,Travel-Query
2085,找到并播放打日本的抗战剧亮剑,FilmTele-Play
2086,去听一听上海广播电台的新闻,Radio-Listen
2087,将周三晚上7点去参加歌唱比赛设定好行程。,Alarm-Update
2088,唐嫣的锦绣未央立刻播放一下呢,FilmTele-Play
2089,记一下2月24号的提醒改到3月22号提醒,Alarm-Update
2090,你赶紧给我查5月1日是什么节日,Calendar-Query
2091,播放陈情令的有声小说,Audio-Play
2092,武汉有多少所体育类型的大学,Radio-Listen
2093,怎么到现代城啊,Travel-Query
2094,来一首古筝版本的十面埋伏可以不,Music-Play
2095,拨到琼海人民广播电台我要听享聊生活,Radio-Listen
2096,愚人节是几月几号,Calendar-Query
2097,一九六零年生英国跨界女高音歌手和演员嗓音嘹亮被誉为天籁之声,FilmTele-Play
2098,我要听频率是一零零点六的海门广播电台,Radio-Listen
2099,能否在10点新建提醒系统杀毒,Alarm-Update
2100,还是听着赵雷的鼓楼,Music-Play
2101,帮我预约电饭煲明早7点的煮饭模式,HomeAppliance-Control
2102,芒种播放给我一直放K歌必点啊,Music-Play
2103,收听经济类的山东人民广播电台经济频道,Radio-Listen
2104,麻烦帮我制定个明天早晨5点钟起床赶高铁的闹钟。,Alarm-Update
2105,卡通台现在有什么节目可以打发时间我想看下,TVProgram-Play
2106,接着收听王冰月的童年回忆,FilmTele-Play
2107,播放豆瓣评分第一的肖申克的救赎？,FilmTele-Play
2108,姜广涛配音的广播剧魔道祖师,Audio-Play
2109,最近一周富士山会有大风出现吗,Weather-Query
2110,你们小时候最崇拜的男人是谁,FilmTele-Play
2111,西游降魔篇13年上线的那个播放给我吧,FilmTele-Play
2112,查询双鸭山气温这几天热么,Weather-Query
2113,有人想听郭冬临的小品面试放一下,Audio-Play
2114,蓝洁瑛为何发疯近日遭法院颁令强制留院治疗二,FilmTele-Play
2115,烟台去济南开车要几个小时？,Travel-Query
2116,梁朝伟和刘嘉玲李嘉欣和许晋亨倪震和周慧敏徐熙媛和周渝民,FilmTele-Play
2117,请给我续播推理小说清明上河图密码的第五章,Audio-Play
2118,现在块给我播一个法文版的野天鹅来听,Audio-Play
2119,自动咖啡的模式调到香醇,HomeAppliance-Control
2120,播放连丽如讲的十二女侠,FilmTele-Play
2121,给我找出来单田芳讲的三侠五义听听,Audio-Play
2122,帮我找下百家讲坛这期节目在哪个频道直播呢,TVProgram-Play
2123,想继续看一会八月未央电视剧呢,FilmTele-Play
2124,你可以播放将军令的纯古筝版吗,Music-Play
2125,非诚勿扰照常播出乐嘉微博称为三周前录制,FilmTele-Play
2126,将明天的日程给我全部删除,Alarm-Update
2127,帮我播放单田芳的评书,Audio-Play
2128,我想看看今年万圣节是几月几号,Calendar-Query
2129,来一首今年最火的抖音歌曲给我吧,Music-Play
2130,这个星期华盛顿飞纽约的航班最便宜的时段是在什么时候？,Travel-Query
2131,赶紧查询汕尾去往广州的大客车发车了没,Travel-Query
2132,麻烦给我播放德云社的群口相声,Audio-Play
2133,能不能在2个小时后叫我去洗澡,Alarm-Update
2134,播一下章鱼讲故事讲的悬疑小说,Audio-Play
2135,循环播放园丁和主人这个故事给我听,Audio-Play
2136,查一查最近从桂林到西安的汽车车次,Travel-Query
2137,想听刘禹锡的诗秋词,Music-Play
2138,我想对孩子们而言让他们的伤痛得到有效宣泄就是最重要的事情了,FilmTele-Play
2139,来一首智珉的歌Hey,Music-Play
2140,放一下有声的紫襟演播的恐怖小说,Audio-Play
2141,一场关于爱情的谎言在4月26播放的花絮有么,Video-Play
2142,记得帮我建一个4月2号去和朋友一起逛街的提醒,Alarm-Update
2143,帮我打开合肥购物看看合肥购物正在卖些什么东西,Other
2144,设定明天晚上10点看直播的闹钟,Alarm-Update
2145,请问圣诞节是什么时候,Calendar-Query
2146,帮我找到坐车到北京的路线,Travel-Query
2147,明天要去烧烤，看一下天气怎么样,Weather-Query
2148,喜剧飞驰人生可以播放一下吗,FilmTele-Play
2149,我想你给我看看日本电影的溺水小刀呢,FilmTele-Play
2150,能帮我看一下下个月3号是什么纪念日吗,Calendar-Query
2151,能不能帮我查看一下端午节是农历几号,Calendar-Query
2152,张国荣的同道中人你能不能播放一下啊,FilmTele-Play
2153,武僧传奇之蹴鞠之战多个台正在转播中观看一下,Video-Play
2154,周迅陈坤刘嘉玲也表示一定会看大阅兵,FilmTele-Play
2155,现在国内外的豪华列车有哪些,FilmTele-Play
2156,我要循环播青蛙王子的故事,Audio-Play
2157,我想知道今年春节是几月几号,Calendar-Query
2158,你是怎么看待这句话的,Other
2159,找找去聊城三中的路,Travel-Query
2160,智能电热毯温度设定在四十到五十度之间,HomeAppliance-Control
2161,去年的几月几号是万元节,Calendar-Query
2162,风波不断的肩上蝶在诞生的过程中究竟发生了什么事,Other
2163,2020年吉杰淘宝直播帮我找一下,Video-Play
2164,打开FM104.5旅游之声电台，放Family,Radio-Listen
2165,单田芳讲的白眉大侠播放一下,Audio-Play
2166,告诉我福州今天适合穿什么衣服,Weather-Query
2167,四十岁到六十岁登上健康快车,Radio-Listen
2168,帮我放频率是九零点九的商业电台第二台,Radio-Listen
2169,搜索并播放科教频道的百家说故事,Radio-Listen
2170,查询下周河北多地会有降雨加雪吗,Weather-Query
2171,CCTV8电视剧频道5月26都播出过哪些电视剧呢,TVProgram-Play
2172,听听中心是做什么用啊,Calendar-Query
2173,回放今天上午10点在CCTV11播出的传奇大掌柜,Video-Play
2174,北流现在紫外线指数多少,Weather-Query
2175,速度规划一条走高速的去沈阳路线,Travel-Query
2176,怎样挂Q而且不用下载要二十四小时在线的,Other
2177,我想听柳永的雨霖铃这首诗,Music-Play
2178,二零一二年一月二十六日,Music-Play
2179,回放5月21日的西安新闻综合的直播西安,Video-Play
2180,太热了，把风扇风大点吧,HomeAppliance-Control
2181,给我找一下5月25号王者荣耀的解说视频,Video-Play
2182,仔细的查看一下今天有惠州始发到汕头的大巴吗,Travel-Query
2183,今天温度很低大家要注意保暖,Weather-Query
2184,我想把怪咖这个专辑顺序播放下呢,Music-Play
2185,然而大家不知道的是这位才女不仅能演能唱更是有着一身好舞艺,Music-Play
2186,我想看2019到2020CBA联赛的所有视频,Video-Play
2187,我爱健康这个节目还是在七点多开播吗帮我看下,TVProgram-Play
2188,韩国综艺节目认识的哥哥帮我找一下,Video-Play
2189,30分钟以后关掉显示屏这个备忘录删除,Alarm-Update
2190,福布斯是最新推荐全国十大富豪,FilmTele-Play
2191,今天的朝闻天下你有录下来吗,Weather-Query
2192,帮我找出王一博的电台FM85,Radio-Listen
2193,大平唱的孝敬爹和妈放一下,Music-Play
2194,给我放一个李商隐的诗词吧,Audio-Play
2195,搜索一下CCTV7正在直播的节目,TVProgram-Play
2196,可以告诉我荆州开来的大巴是6点的吗,Travel-Query
2197,把儿童房的灯关掉好吗,HomeAppliance-Control
2198,我是有钱就花没钱就不花,Other
2199,找几个张学友唱歌的视频来看,Video-Play
2200,能找一下2020年肖战的剧播放吗,FilmTele-Play
2201,加拿大2012的人类进化史诗这部纪录片播放,Video-Play
2202,来自岁月积蕴的智慧让我们一起聆听,FilmTele-Play
2203,查一下这月重庆是否有冰雹,Weather-Query
2204,北郊站到郑州东站的火车票有没有,Travel-Query
2205,播一个岳云鹏孙越的精彩相声非一般的爱情来听,Audio-Play
2206,八月五日有到深圳的汽车票吗,Travel-Query
2207,就不告诉你呀我就不告诉你就不告诉你,Other
2208,FM87.6放音乐呢吗看一看,Radio-Listen
2209,我要循环的听一只很饿很饿的小猪的故事,Music-Play
2210,后天上午九点从南京出发地飞机,Travel-Query
2211,5月22日播放的法治第一线今天有重播吧,TVProgram-Play
2212,看一下济南去淄博的大巴是13点30的不,Travel-Query
2213,你一定要在12月15号之前提醒我还房贷,Alarm-Update
2214,我想到酒泉旅行哪里最好,Travel-Query
2215,来一个节奏快的美国电影播放一下吧,FilmTele-Play
2216,发现山西在今天上午九点四十九分播吗帮我看下,TVProgram-Play
2217,2020年美国电影花木兰的预告片给我找一下,Video-Play
2218,播报一下明天需要穿个外套吗，会有强降雨不,Weather-Query
2219,RNG.M比赛的视频帮我找一下,Video-Play
2220,海贼王这个礼拜周日更新的那集播放一下,Video-Play
2221,我要去北京翻译成英语,Travel-Query
2222,明天去南京的高铁票还有吗,Travel-Query
2223,动漫咱们的裸熊帮我找一下吧,Video-Play
2224,按照更新顺序播放动画片小羊肖恩,Video-Play
2225,我要做蛋糕，帮我把电饭煲调成蒸蛋糕模式吧,HomeAppliance-Control
2226,明天开始春运抢票设置个闹钟,Alarm-Update
2227,5月13号在中央8套播出的朝闻天下帮我播出一下,TVProgram-Play
2228,帮我播放正在直播的国际足球赛场-20-21赛季意甲联赛第38轮1,TVProgram-Play
2229,十二乘以五再乘以三再除以八等于多少,HomeAppliance-Control
2230,讲一下老头子做事总不会错这个故事给我听,Audio-Play
2231,单曲循环民谣南山南,Music-Play
2232,你是否一个体贴细心的女朋友,Other
2233,给我查查青岛去往深圳的动车是16点的吗,Travel-Query
2234,随便放一首专辑写一首歌里的歌儿,Music-Play
2235,给我播放灵异类的有声漫画,Video-Play
2236,单曲循环一下莱芙里面的曲子吧,Music-Play
2237,江苏城市的家屋室的主人播放了吗帮我看下,TVProgram-Play
2238,临近预产期要怎么运动,Travel-Query
2239,那个综艺叫密室逃脱给我搜一下,FilmTele-Play
2240,好忙呀我现在的电话每一秒钟就响等儿媳出院再商量啦,Radio-Listen
2241,4点的时候通知我接孩子,Alarm-Update
2242,她笑称不会那么亲切啦,Other
2243,请续播烈日灼心这部小说的第五章,Audio-Play
2244,问到有没有担心过离开星辉演艺生涯受到影响,Other
2245,给我调到九四点八的香港电台第二台,Radio-Listen
2246,把空调的风速调大,HomeAppliance-Control
2247,放一个岳云鹏孙越的相声我们不一样来听一下,Audio-Play
2248,我哭了谢谢你给了我很多的感悟一颗温暖的卤蛋,Other
2249,说一下16点有威海去武汉的火车吗,Travel-Query
2250,在家吗还好吧弄点好吃的新年快乐,Radio-Listen
2251,新建一个6月10号下午6点的提醒,Alarm-Update
2252,可以不可以把空调调到18度,HomeAppliance-Control
2253,顾名思义可以理解为微细表情说了这是一种下意识的表情,Radio-Listen
2254,动漫斗破苍穹的第4季播放第9集,Video-Play
2255,骑车去学校最短的线路怎么走,Travel-Query
2256,演唱者斯黛芬妮劳伦斯,FilmTele-Play
2257,播一下章鱼讲故事讲的的灵异小说,Audio-Play
2258,给我读一下安徒生的白雪皇后俄语版的,Audio-Play
2259,把空调调成最低16吧,HomeAppliance-Control
2260,我想看2012年麦当娜在巴黎举行演唱会的那个视频,Video-Play
2261,播放一个豆瓣评分最高的日本纪录片来看,Video-Play
2262,我想看一个台湾演员林心如的电视剧呢,FilmTele-Play
2263,找到CCTV12现在正在直播哪个节目播放,TVProgram-Play
2264,蔡徐坤的情人最近很火，请给我播放一首情人。,Music-Play
2265,黎耀祥陈豪邓萃雯畲诗曼陈法拉敖嘉年杨怡马浚伟等到场出席,Radio-Listen
2266,看看空调是多少度行嘛,HomeAppliance-Control
2267,放放郭德纲的2021年天津春晚相声富贵人生来听,Video-Play
2268,我想知道前天是几月几号,Calendar-Query
2269,我打电话给我老婆打电话,Other
2270,查找一下B站婷婷助眠的视频,Video-Play
2271,霍尊唱的英文歌曲来一首可以吗,Music-Play
2272,收听雅娟的空中笑林电台节目,Radio-Listen
2273,把家里的空调关了有点冷,HomeAppliance-Control
2274,找一下那个恋恋不忘的第25集,FilmTele-Play
2275,搞笑有声漫画播一个给我,Other
2276,几月几号是端午节,Calendar-Query
2277,悬崖是不是在CCTV8播出已经播放到第几集了,FilmTele-Play
2278,马上给放王维的相思,Music-Play
2279,我想看一个英国拍的历史剧呢,FilmTele-Play
2280,今年的冬至是周几,Calendar-Query
2281,沈腾2018年以前的电影给我播放一个,FilmTele-Play
2282,你是不是可以在90分钟后提醒关闭电脑,Alarm-Update
2283,赵本山形容大长脸的脸,Video-Play
2284,华为P30的开箱视频找一下,Video-Play
2285,给我循环朗读李商隐的夜雨寄北,Music-Play
2286,播放钟馗捉妖记有关神话的剧,FilmTele-Play
2287,10点的旅游百事通听它,Radio-Listen
2288,搜索一下CCTV1精彩一刻-2020-186新航拍中国湖南洞庭湖,Video-Play
2289,几月几号是添仓节,Calendar-Query
2290,明星开动物玩笑被批何超莲被轰冷血千金,FilmTele-Play
2291,2018年的七夕节是几月几号,Calendar-Query
2292,空气净化器设置为高速模式好么,HomeAppliance-Control
2293,朴信惠演的韩国电视剧随机播放一个给我看,FilmTele-Play
2294,下载一本电子书给我看,FilmTele-Play
2295,南都以前拍戏有过这种感觉吗,Weather-Query
2296,华商晨报上春晚家里人应该很自豪吧,FilmTele-Play
2297,今年的护士节是周几,Calendar-Query
2298,八点二十八分的有啥说啥文旅郑州还能重播不帮我看下,TVProgram-Play
2299,五十二届格莱美最佳摇滚专辑奖提名名单,Music-Play
2300,是不是能继续播放杨幂的扶摇吗,FilmTele-Play
2301,请播放伍思凯老师的《特别的爱给特别的你》,Music-Play
2302,找一下怎么到高就村,Travel-Query
2303,我想了解明天邢台的紫外线情况,Weather-Query
2304,今晚7点10分山东农科将要播放什么节目帮我看下,TVProgram-Play
2305,我想看一个去年上线的悬疑剧呢,FilmTele-Play
2306,张柏芝胞弟与孙祖杨现身英皇总部东洋味十足,FilmTele-Play
2307,请循环收听王浩主持的电影天堂,Radio-Listen
2308,钱钟书有个小说叫围城的放来听,Audio-Play
2309,长江周边正常的湿气指数是多少,Weather-Query
2310,有搞笑的宠物视频吗想看下,Video-Play
2311,你像小孩的样子好可爱的我喜欢嘿嘿,Music-Play
2312,我要看赵丽颖和金瀚演的那个你和我的倾城时光,FilmTele-Play
2313,是否能续播一下那个玄幻剧,FilmTele-Play
2314,气温下降的厉害，调大电火炉的温度。,Weather-Query
2315,杨坤履行抗抑郁大使职责北大提供心理咨询图,Other
2316,播放蔡依林的日不落,Music-Play
2317,我还想看80年代的科幻电影,FilmTele-Play
2318,给我吧空调风速降到一格,HomeAppliance-Control
2319,你可以给我定一个明天5:10的闹钟吗,Alarm-Update
2320,给我放一个高桥留美子的日本动漫片剪辑版视频,Video-Play
2321,日本电影版火影忍者我想看。,FilmTele-Play
2322,请给我播放雪梅这首古诗,Music-Play
2323,我想开窗换气,FilmTele-Play
2324,看一下能不能订三张明天早上飞南宁的商务舱机票,Travel-Query
2325,能不能订三张明天早上飞重庆的经济舱,Travel-Query
2326,汪苏泷专辑克制凶猛顺序播放一下啊,Music-Play
2327,夜半更深对朗月几多愁难入眠想找一个聊天谈话的电话,FilmTele-Play
2328,2020年最火的古典音乐来一首吧,Music-Play
2329,我要听普希金的渔夫和金鱼的故事的英文版的,Audio-Play
2330,13点有深圳始发去汕头的长途车不,Travel-Query
2331,我还不知道发往淮安的大巴明天有没有票呢,Travel-Query
2332,想听听90年代邓丽君的歌曲,Music-Play
2333,搜一下美国DC系列的神奇女侠,FilmTele-Play
2334,收听北京交通广播的行走天下,Radio-Listen
2335,查一下回妈妈家的步行路线,Travel-Query
2336,我想看电视剧频道播出的我的仨妈俩爸查看一下往期视频,Video-Play
2337,想看特别关注，麻烦给我打开新闻吧,TVProgram-Play
2338,循环播放郭德纲的相声笑到不行给我听,Audio-Play
2339,再找下到电子商贸学校的路,Travel-Query
2340,帮我转到贵州卫视看看有什么节目吧,TVProgram-Play
2341,我想听故事萤火虫对星星说循环播放,Audio-Play
2342,哪些小窍门使身上的蚊虫疤痕轻松去除,Music-Play
2343,后天是农历几月几日,Calendar-Query
2344,今年的新年除夕是星期几,Calendar-Query
2345,农历的什么时候是立秋,Calendar-Query
2346,我妈比较喜欢看冯巩的小品，随机播放一个出来吧,Video-Play
2347,我想听英文版的最后的珠子这个故事,Audio-Play
2348,帮我设定一个今天上午9点30分陪妈妈看戏的闹钟。,Alarm-Update
2349,合肥市现在已经开始下雪了但我这还没下,Other
2350,几月几号是成人节,Calendar-Query
2351,一泰坦尼克号一八四二八七九九五五,FilmTele-Play
2352,浴霸切换到暖风模式可以吗,HomeAppliance-Control
2353,过两天太原的空气质量是多少呢,Weather-Query
2354,快给放威廉豪夫的故事商队来听,Audio-Play
2355,小年是什么时候,Calendar-Query
2356,现在给我设一个明天14:30的闹铃,Alarm-Update
2357,准备将食物放着等会再吃，帮我切换到蒸烤箱的保温功能行么,HomeAppliance-Control
2358,我想知道世界战史这个节目是在哪个频道播出的,TVProgram-Play
2359,给我找出来刘兰芳讲的岳飞传听听,Audio-Play
2360,咸猪手事件升级官恩娜及无线台再曝新丑闻图,Video-Play
2361,给我回放2018年在俄罗斯举行的世界杯,Video-Play
2362,随机放一个古装电视剧里的歌曲吧,Music-Play
2363,说我没有接到他的电话,Other
2364,一二月三日晚上起高璇就发表了十几条关于编剧署名维权的微博,Alarm-Update
2365,北京卫视5月23的午间节目有哪些,TVProgram-Play
2366,能不能看看安庆开过来的客车是几点呢,Travel-Query
2367,16点的正点财经正在直播中点击播放,Radio-Listen
2368,麻烦帮我找下中国戏剧广播里的秦腔节目按节目列表顺序播放,Radio-Listen
2369,韩寒的经营之道就是正版签名,Radio-Listen
2370,随便收听一个经济类新闻的电台吧,Radio-Listen
2371,律师认为检方涉嫌程序违法,FilmTele-Play
2372,现在续播黑山老妖小说的第十二章,Audio-Play
2373,张元这既是一种现实也是不现实,Calendar-Query
2374,林俊杰的专辑对的时间点播放,Music-Play
2375,王者荣耀的打野专场有吗，我想看,Video-Play
2376,我要听白杰的先听为快帮我调下,Radio-Listen
2377,我现在要听北京文艺广播的空中笑林,Radio-Listen
2378,去年上的那个美国电视剧现在播一下,FilmTele-Play
2379,不知道今晚的中央四有什么节目看，帮我看下,TVProgram-Play
2380,能不能帮我建一个今天下午5点去买旗袍的提醒,Alarm-Update
2381,空调暖风再往低调一下,HomeAppliance-Control
2382,厦门空气质量怎么样,Weather-Query
2383,请回答我重庆飞上海的飞机起飞了吗,Travel-Query
2384,我想把你的名字改成贝贝,FilmTele-Play
2385,江苏卫视的时代问答帮我重新播放一次,Radio-Listen
2386,16点你记得通知我洗头,Alarm-Update
2387,我想看CCTV1星光大道的往期节目,Video-Play
2388,我需要制定一个周五上午9点半面试的闹钟。,Alarm-Update
2389,放一下高尔基的小说童年,Audio-Play
2390,打电话二零五八五零零,Other
2391,告我一下大连未来三天有没有大风,Weather-Query
2392,再放一首鞠婧祎的过去完成时,Music-Play
2393,今天中午更新的心动的信号找一下来看这综艺还挺好看的,Video-Play
2394,十点半的环球综艺有什么综艺看,TVProgram-Play
2395,打算怎么过这个年啊小李他们好像不回去,FilmTele-Play
2396,查询播放新疆一周的室外气温,Weather-Query
2397,我想十分钟之后听首张小斐的萱草花,Music-Play
2398,今天上午10点我要去超市，帮我设置一下,Alarm-Update
2399,你平时都有什么爱好啊,Other
2400,今天的中国城市报道是不是五点帮我看下,TVProgram-Play
2401,随便播放一首英文歌,Music-Play
2402,李冰冰和吴尊演的谜巢看一下,FilmTele-Play
2403,播放美国NBA球赛,Video-Play
